[
  {
    "id": "fuuton_lamina_vento",
    "name": "Fuuton: Lâmina de Vento",
    "description": "Uma lâmina de ar comprimido cortando em linha reta até o alvo.",
    "element": "fuuton",
    "type": "projectile",
    "range": 6,
    "chakra_cost": 0,
    "cooldown_s": 9.0,
    "base_damage": 4.0,
    "level_scale": 5.35,
    "skill_scale": 0.115,
    "skill": "ninjutsu",
    "required_level": 1,
    "villages": [],
    "tier": 1,
    "animation": "fx_wind_blade",
    "sfx": "sfx_wind_cut",
    "chakra_cost_percent": 13.0
  },
  {
    "id": "fuuton_rajada_cortante",
    "name": "Fuuton: Rajada Cortante",
    "description": "Uma rajada em leque que retalha tudo à frente e desequilibra os atingidos.",
    "element": "fuuton",
    "type": "area",
    "shape": "cone_3",
    "range": 3,
    "chakra_cost": 147,
    "cooldown_s": 6.5,
    "base_damage": 38.99,
    "level_scale": 3.886,
    "skill_scale": 1.17,
    "skill": "ninjutsu",
    "required_level": 16,
    "villages": [],
    "tier": 2,
    "effects": [
      {
        "type": "slow",
        "chance": 0.5,
        "duration_s": 3,
        "value": 0.35
      }
    ],
    "animation": "fx_wind_cone",
    "sfx": "sfx_wind_burst"
  },
  {
    "id": "fuuton_tornado_cortante",
    "name": "Fuuton: Tornado Cortante",
    "description": "Uma coluna de vento afiado que avança em linha reta, despedaçando tudo no caminho.",
    "element": "fuuton",
    "type": "beam",
    "shape": "line_6",
    "range": 6,
    "chakra_cost": 243,
    "cooldown_s": 8.0,
    "base_damage": 32.4,
    "level_scale": 6.48,
    "skill_scale": 0.0518,
    "skill": "ninjutsu",
    "required_level": 36,
    "villages": [],
    "tier": 3,
    "effects": [
      {
        "type": "slow",
        "chance": 0.6,
        "duration_s": 4,
        "value": 0.4
      }
    ],
    "animation": "fx_wind_tornado",
    "sfx": "sfx_wind_roar"
  },
  {
    "id": "fuuton_redemoinho_prisao",
    "name": "Fuuton: Redemoinho Prisão",
    "description": "Um redemoinho de vento prende o alvo no ar, impedindo qualquer movimento.",
    "element": "fuuton",
    "type": "target",
    "range": 4,
    "chakra_cost": 45,
    "cooldown_s": 9.0,
    "base_damage": 18.0,
    "level_scale": 0.72,
    "skill_scale": 0.9,
    "skill": "genjutsu",
    "required_level": 23,
    "villages": [],
    "tier": 2,
    "effects": [
      {
        "type": "paralyze",
        "chance": 0.75,
        "duration_s": 3.0
      }
    ],
    "animation": "fx_wind_prison",
    "sfx": "sfx_wind_trap"
  }
]
