[
 {
  "id": "kawarimi",
  "name": "Kawarimi no Jutsu",
  "description": "Substituição: fica invulnerável por 1s e teleporta 2 tiles para trás.",
  "element": "none",
  "type": "self",
  "range": 0,
  "chakra_cost": 30,
  "cooldown_s": 12.0,
  "base_damage": 0,
  "level_scale": 0,
  "skill_scale": 0,
  "skill": "genjutsu",
  "required_level": 5,
  "villages": [],
  "tier": 1,
  "animation": "fx_log_poof",
  "sfx": "sfx_poof"
 },
 {
  "id": "bunshin",
  "name": "Bunshin no Jutsu",
  "description": "Cria 2 clones que distraem monstros por 6s.",
  "element": "none",
  "type": "self",
  "range": 0,
  "chakra_cost": 35,
  "cooldown_s": 15.0,
  "base_damage": 0,
  "level_scale": 0,
  "skill_scale": 0,
  "skill": "genjutsu",
  "required_level": 8,
  "villages": [],
  "tier": 1,
  "animation": "fx_clone_poof",
  "sfx": "sfx_poof"
 },
 {
  "id": "shousen",
  "name": "Shousen: Palma Curativa",
  "description": "Cura o próprio HP ao longo de 5s.",
  "element": "none",
  "type": "self",
  "range": 0,
  "chakra_cost": 47,
  "cooldown_s": 10.0,
  "base_damage": 0,
  "level_scale": 0,
  "skill_scale": 0,
  "skill": "ninjutsu",
  "required_level": 10,
  "villages": [],
  "tier": 1,
  "effects": [
   {
    "type": "heal_over_time",
    "chance": 1,
    "duration_s": 5,
    "value": 8
   }
  ],
  "animation": "fx_heal_glow",
  "sfx": "sfx_heal"
 },
 {
  "id": "fuuin_contencao",
  "name": "Fuuin: Selo de Contenção",
  "description": "Selo de papel que trava os músculos do alvo por alguns segundos.",
  "element": "none",
  "type": "target",
  "range": 4,
  "chakra_cost": 50,
  "cooldown_s": 12.0,
  "base_damage": 20,
  "level_scale": 1.2,
  "skill_scale": 1.75,
  "skill": "genjutsu",
  "required_level": 40,
  "villages": [],
  "tier": 2,
  "effects": [
   {
    "type": "paralyze",
    "chance": 0.85,
    "duration_s": 4.0
   }
  ],
  "animation": "fx_seal_paper",
  "sfx": "sfx_seal"
 },
 {
  "id": "doku_kiri",
  "name": "Doku: Névoa Venenosa",
  "description": "Exala uma névoa roxa ao redor do conjurador; quem respira sai envenenado.",
  "element": "none",
  "type": "area",
  "shape": "circle_r2",
  "range": 2,
  "chakra_cost": 54,
  "cooldown_s": 6.0,
  "base_damage": 19.8,
  "level_scale": 1.155,
  "skill_scale": 0.25,
  "skill": "ninjutsu",
  "required_level": 25,
  "villages": [],
  "tier": 2,
  "effects": [
   {
    "type": "poison",
    "chance": 0.85,
    "duration_s": 10,
    "value": 6
   }
  ],
  "animation": "fx_poison_mist",
  "sfx": "sfx_hiss"
 },
 {
  "id": "clone_sombrio",
  "name": "Clone Sombrio",
  "description": "Invoca dois clones de sombra que distraem os inimigos por um instante.",
  "element": "none",
  "type": "self",
  "range": 0,
  "chakra_cost": 47,
  "cooldown_s": 20.0,
  "base_damage": 0,
  "level_scale": 0,
  "skill_scale": 0,
  "skill": "genjutsu",
  "required_level": 10,
  "villages": [],
  "tier": 1,
  "animation": "fx_smoke_puff",
  "sfx": "sfx_poof"
 },
 {
  "id": "punho_suave",
  "name": "Punho Suave",
  "description": "Golpe preciso que atinge pontos de chakra e retarda o alvo.",
  "element": "none",
  "type": "target",
  "range": 1,
  "chakra_cost": 20,
  "cooldown_s": 2.0,
  "base_damage": 20,
  "level_scale": 1.0,
  "skill_scale": 0.9,
  "skill": "taijutsu",
  "required_level": 3,
  "villages": [],
  "tier": 1,
  "effects": [
   {
    "type": "slow",
    "chance": 0.25,
    "duration_s": 3,
    "value": 0.3
   }
  ],
  "animation": "fx_taijutsu_hit",
  "sfx": "sfx_punch"
 },
 {
  "id": "chute_giratorio",
  "name": "Chute Giratorio",
  "description": "Chute em rotacao que acerta todos ao redor.",
  "element": "none",
  "type": "area",
  "shape": "circle_r1",
  "range": 1,
  "chakra_cost": 28,
  "cooldown_s": 4.0,
  "base_damage": 13.1,
  "level_scale": 0.854,
  "skill_scale": 0.547,
  "skill": "taijutsu",
  "required_level": 14,
  "villages": [],
  "tier": 2,
  "animation": "fx_taijutsu_spin",
  "sfx": "sfx_whirl"
 },
 {
  "id": "agulhas_multiplas",
  "name": "Agulhas Multiplas",
  "description": "Uma saraivada de agulhas de metal lancadas contra o alvo.",
  "element": "none",
  "type": "projectile",
  "range": 5,
  "chakra_cost": 26,
  "cooldown_s": 2.0,
  "base_damage": 16,
  "level_scale": 0.9,
  "skill_scale": 0.9,
  "skill": "shuriken",
  "required_level": 1,
  "villages": [],
  "tier": 1,
  "animation": "fx_needles",
  "sfx": "sfx_metal_throw"
 },
 {
  "id": "lamina_chakra",
  "name": "Lamina de Chakra",
  "description": "Uma lamina invisivel de chakra que atravessa varios inimigos em linha reta.",
  "element": "none",
  "type": "beam",
  "shape": "line_5",
  "range": 5,
  "chakra_cost": 34,
  "cooldown_s": 5.0,
  "base_damage": 35,
  "level_scale": 2.1,
  "skill_scale": 1.375,
  "skill": "shuriken",
  "required_level": 20,
  "villages": [],
  "tier": 2,
  "animation": "fx_chakra_blade",
  "sfx": "sfx_slash"
 }
]
