[
  {
    "id": "raiton_hari",
    "name": "Raiton: Agulha de Raio",
    "description": "Agulha elétrica rápida, pode paralisar.",
    "element": "raiton",
    "type": "projectile",
    "range": 7,
    "chakra_cost": 14,
    "cooldown_s": 1.5,
    "base_damage": 20,
    "level_scale": 1.1,
    "skill_scale": 0.9,
    "skill": "ninjutsu",
    "required_level": 1,
    "villages": [],
    "tier": 1,
    "effects": [
      {
        "type": "paralyze",
        "chance": 0.15,
        "duration_s": 1.5
      }
    ],
    "animation": "fx_lightning_needle",
    "sfx": "sfx_zap"
  },
  {
    "id": "raiton_punho_trovao",
    "name": "Raiton: Punho do Trovão",
    "description": "Concentra o raio na palma da mão e desfere um golpe devastador no alvo adjacente.",
    "element": "raiton",
    "type": "target",
    "range": 1,
    "chakra_cost": 50,
    "cooldown_s": 7.0,
    "base_damage": 90,
    "level_scale": 2.2,
    "skill_scale": 1.3,
    "skill": "ninjutsu",
    "required_level": 30,
    "villages": [],
    "tier": 3,
    "effects": [
      {
        "type": "stun",
        "chance": 0.5,
        "duration_s": 1.0
      }
    ],
    "animation": "fx_thunder_fist",
    "sfx": "sfx_thunder_hit"
  },
  {
    "id": "raiton_corrente_estatica",
    "name": "Raiton: Corrente Estática",
    "description": "A eletricidade salta em cruz pelo chão a partir do conjurador.",
    "element": "raiton",
    "type": "area",
    "shape": "cross_r1",
    "range": 1,
    "chakra_cost": 16,
    "cooldown_s": 2.5,
    "base_damage": 14,
    "level_scale": 0.9,
    "skill_scale": 0.7,
    "skill": "ninjutsu",
    "required_level": 6,
    "villages": [],
    "tier": 1,
    "effects": [
      {
        "type": "paralyze",
        "chance": 0.2,
        "duration_s": 1.0
      }
    ],
    "animation": "fx_static_cross",
    "sfx": "sfx_zap"
  },
  {
    "id": "raiton_lanca_relampago",
    "name": "Raiton: Lança do Relâmpago",
    "description": "Um raio contínuo perfura em linha reta e atravessa vários inimigos.",
    "element": "raiton",
    "type": "beam",
    "shape": "line_5",
    "range": 5,
    "chakra_cost": 40,
    "cooldown_s": 5.5,
    "base_damage": 44,
    "level_scale": 1.5,
    "skill_scale": 1.1,
    "skill": "ninjutsu",
    "required_level": 18,
    "villages": [],
    "tier": 2,
    "effects": [
      {
        "type": "paralyze",
        "chance": 0.35,
        "duration_s": 1.5
      }
    ],
    "animation": "fx_lightning_lance",
    "sfx": "sfx_thunder"
  },
  {
    "id": "raiton_armadura_eletrica",
    "name": "Raiton: Armadura Elétrica",
    "description": "Uma casca de eletricidade cobre o corpo, acelerando a recuperação enquanto dura.",
    "element": "raiton",
    "type": "self",
    "range": 0,
    "chakra_cost": 36,
    "cooldown_s": 16.0,
    "base_damage": 0,
    "level_scale": 0,
    "skill_scale": 0,
    "skill": "ninjutsu",
    "required_level": 24,
    "villages": [],
    "tier": 2,
    "effects": [
      {
        "type": "heal_over_time",
        "chance": 1,
        "duration_s": 8,
        "value": 10
      }
    ],
    "animation": "fx_lightning_armor",
    "sfx": "sfx_zap_loop"
  }
]
