[
  {
    "id": "doton_bala_lama",
    "name": "Doton: Bala de Lama",
    "description": "Uma bala de lama endurecida disparada em alta velocidade.",
    "element": "doton",
    "type": "projectile",
    "range": 6,
    "chakra_cost": 14,
    "cooldown_s": 1.8,
    "base_damage": 23,
    "level_scale": 1.1,
    "skill_scale": 0.85,
    "skill": "ninjutsu",
    "required_level": 1,
    "villages": [],
    "tier": 1,
    "effects": [
      {
        "type": "slow",
        "chance": 0.3,
        "duration_s": 3,
        "value": 0.25
      }
    ],
    "animation": "fx_mud_bullet",
    "sfx": "sfx_splat"
  },
  {
    "id": "doton_muralha_pedra",
    "name": "Doton: Muralha de Pedra",
    "description": "Ergue uma casca de rocha ao redor do corpo, endurecendo a pele por alguns segundos.",
    "element": "doton",
    "type": "self",
    "range": 0,
    "chakra_cost": 28,
    "cooldown_s": 14.0,
    "base_damage": 0,
    "level_scale": 0,
    "skill_scale": 0,
    "skill": "ninjutsu",
    "required_level": 8,
    "villages": [],
    "tier": 1,
    "effects": [
      {
        "type": "heal_over_time",
        "chance": 1,
        "duration_s": 6,
        "value": 6
      }
    ],
    "animation": "fx_stone_shell",
    "sfx": "sfx_rock_rumble"
  },
  {
    "id": "doton_estacas_terra",
    "name": "Doton: Estacas de Terra",
    "description": "Estacas de pedra irrompem do chão em cruz, prendendo quem estiver em cima.",
    "element": "doton",
    "type": "area",
    "shape": "cross_r2",
    "range": 4,
    "chakra_cost": 40,
    "cooldown_s": 6.0,
    "base_damage": 42,
    "level_scale": 1.5,
    "skill_scale": 1.0,
    "skill": "ninjutsu",
    "required_level": 22,
    "villages": [],
    "tier": 2,
    "effects": [
      {
        "type": "paralyze",
        "chance": 0.4,
        "duration_s": 2.0
      }
    ],
    "animation": "fx_earth_spikes",
    "sfx": "sfx_rock_crack"
  },
  {
    "id": "doton_colapso_terreno",
    "name": "Doton: Colapso do Terreno",
    "description": "O solo afunda num raio amplo e esmaga tudo que está dentro da cratera.",
    "element": "doton",
    "type": "area",
    "shape": "circle_r2",
    "range": 5,
    "chakra_cost": 70,
    "cooldown_s": 9.0,
    "base_damage": 85,
    "level_scale": 2.1,
    "skill_scale": 1.3,
    "skill": "ninjutsu",
    "required_level": 48,
    "villages": [],
    "tier": 3,
    "effects": [
      {
        "type": "stun",
        "chance": 0.45,
        "duration_s": 1.5
      }
    ],
    "animation": "fx_earth_collapse",
    "sfx": "sfx_quake"
  }
]
